pub_date,headline,abstract,keywords,lead_paragraph,date_parsed
2025-01-01 00:26:42+00:00,"{'main': 'Dartmouth College Basketball Players Halt Effort to Unionize', 'kicker': None, 'content_kicker': None, 'print_headline': '', 'name': None, 'seo': None, 'sub': None}",The decision to withdraw the petition appeared to be an effort to preserve a favorable federal ruling that could have been in jeopardy under President-elect Donald J. Trump.,"[{'name': 'subject', 'value': 'Basketball (College)', 'rank': 1, 'major': 'N'}, {'name': 'subject', 'value': 'College Athletics', 'rank': 2, 'major': 'N'}, {'name': 'subject', 'value': 'Organized Labor', 'rank': 3, 'major': 'N'}, {'name': 'subject', 'value': 'Student Athlete Compensation', 'rank': 4, 'major': 'N'}, {'name': 'organizations', 'value': 'Dartmouth College', 'rank': 5, 'major': 'N'}, {'name': 'organizations', 'value': 'National College Players Assn', 'rank': 6, 'major': 'N'}, {'name': 'organizations', 'value': 'National Labor Relations Board', 'rank': 7, 'major': 'N'}, {'name': 'organizations', 'value': 'Service Employees International Union', 'rank': 8, 'major': 'N'}]","The Dartmouth College basketball players who voted in March to unionize withdrew their petition on Tuesday, a move largely intended to preserve the favorable federal judgment that they had secured and that could have been in jeopardy once President-elect Donald J. Trump took office.",2025-01-01T00:26:42Z
2025-01-01 00:44:38+00:00,"{'main': '‘He Saved Our Lives.’ Former Hostages Recall Carter’s Quest to Free Them', 'kicker': None, 'content_kicker': None, 'print_headline': '', 'name': None, 'seo': None, 'sub': None}","The Iran hostage crisis became a symbol of a failed presidency, but for some of those who lived it, Jimmy Carter was the one who brought them home at the expense of his own political career.","[{'name': 'subject', 'value': 'United States International Relations', 'rank': 1, 'major': 'N'}, {'name': 'subject', 'value': 'Kidnapping and Hostages', 'rank': 2, 'major': 'N'}, {'name': 'glocations', 'value': 'Iran', 'rank': 3, 'major': 'N'}, {'name': 'persons', 'value': 'Carter, Jimmy', 'rank': 4, 'major': 'N'}, {'name': 'persons', 'value': 'Laingen, L Bruce', 'rank': 5, 'major': 'N'}]","As they sat locked in the same room day after day, week after week, month after month, listening to “death to America” chants and wondering when the bullet might come, the 52 American hostages being held in Iran had no idea what President Jimmy Carter was doing or if he even cared.",2025-01-01T00:44:38Z
2025-02-01 00:03:40+00:00,"{'main': 'Phyllis Dalton, Oscar-Winning Costume Designer for Historical Epics, Dies at 99', 'kicker': None, 'content_kicker': None, 'print_headline': '', 'name': None, 'seo': None, 'sub': None}","A look back at some of her most celebrated works, including “Doctor Zhivago,” “The Princess Bride” and “Lawrence of Arabia.”","[{'name': 'subject', 'value': 'Academy Awards (Oscars)', 'rank': 2, 'major': 'N'}, {'name': 'subject', 'value': 'Deaths (Obituaries)', 'rank': 3, 'major': 'N'}, {'name': 'subject', 'value': 'Costumes', 'rank': 4, 'major': 'N'}, {'name': 'subject', 'value': 'Movies', 'rank': 5, 'major': 'N'}, {'name': 'subject', 'value': 'Fashion and Apparel', 'rank': 6, 'major': 'N'}, {'name': 'glocations', 'value': 'England', 'rank': 7, 'major': 'N'}, {'name': 'creative_works', 'value': 'Doctor Zhivago (Movie)', 'rank': 8, 'major': 'N'}, {'name': 'creative_works', 'value': 'Henry V (Movie)', 'rank': 9, 'major': 'N'}, {'name': 'creative_works', 'value': 'Lawrence of Arabia (Movie)', 'rank': 10, 'major': 'N'}]","Phyllis Dalton, a British costume designer whose unflinching attention to detail earned her Oscars for “Doctor Zhivago” and “Henry V” and acclaim for her emotive, striking costumes in “Lawrence of Arabia,” died on Jan. 9 at her home in Somerset, England. She was 99.",2025-02-01T00:03:40Z
2025-02-01 00:20:17+00:00,"{'main': 'How Trump’s Tariffs Could Affect Americans', 'kicker': None, 'content_kicker': None, 'print_headline': '', 'name': None, 'seo': None, 'sub': None}","President Trump relies on tariffs to address trade, immigration and drug issues. Ana Swanson, who covers trade and international economics for The New York Times, explains their potential impact on everyday Americans.","[{'name': 'organizations', 'value': 'World Trade Organization', 'rank': 1, 'major': 'N'}, {'name': 'subject', 'value': 'North American Free Trade Agreement', 'rank': 2, 'major': 'N'}, {'name': 'subject', 'value': 'International Relations', 'rank': 3, 'major': 'N'}, {'name': 'subject', 'value': 'United States International Relations', 'rank': 4, 'major': 'N'}, {'name': 'subject', 'value': 'United States Economy', 'rank': 5, 'major': 'N'}]","President Trump relies on tariffs to address trade, immigration and drug issues. Ana Swanson, who covers trade and international economics for The New York Times, explains their potential impact on everyday Americans.",2025-02-01T00:20:17Z
2025-02-01 00:28:08+00:00,"{'main': 'Reagan Airport Had a Number of Close Calls in Recent Years', 'kicker': None, 'content_kicker': None, 'print_headline': '', 'name': None, 'seo': None, 'sub': None}",Internal government reports and public databases highlight several instances in which planes narrowly escaped collisions with each other or helicopters.,"[{'name': 'subject', 'value': 'AIRLINES AND AIRPLANES', 'rank': 1, 'major': 'N'}, {'name': 'subject', 'value': 'AIR TRAFFIC CONTROL', 'rank': 2, 'major': 'N'}, {'name': 'subject', 'value': 'Aviation Accidents, Safety and Disasters', 'rank': 3, 'major': 'N'}, {'name': 'subject', 'value': 'American Airlines Flight 5342', 'rank': 4, 'major': 'N'}, {'name': 'subject', 'value': 'Helicopters', 'rank': 5, 'major': 'N'}, {'name': 'subject', 'value': 'Pilots', 'rank': 6, 'major': 'N'}, {'name': 'subject', 'value': 'Airports', 'rank': 7, 'major': 'N'}, {'name': 'subject', 'value': 'Private Aircraft', 'rank': 8, 'major': 'N'}, {'name': 'organizations', 'value': 'Federal Aviation Administration', 'rank': 9, 'major': 'N'}, {'name': 'organizations', 'value': 'Reagan, Ronald, Washington National Airport', 'rank': 10, 'major': 'N'}, {'name': 'glocations', 'value': 'Potomac River', 'rank': 11, 'major': 'N'}, {'name': 'glocations', 'value': 'Washington (DC)', 'rank': 12, 'major': 'N'}]","Before the deadly plane crash on Wednesday night near Ronald Reagan National Airport, there were at least 10 close calls at the Washington airport in the last three years that were documented in government records reviewed by The New York Times.",2025-02-01T00:28:08Z
2025-02-01 00:35:55+00:00,"{'main': '6 Feared Dead After Medical Plane Crashes Near Philadelphia Shopping Center', 'kicker': None, 'content_kicker': None, 'print_headline': '', 'name': None, 'seo': None, 'sub': None}","The Learjet, carrying a pediatric patient and five others, crashed in Northeast Philadelphia. It was flying to Mexico with a stop planned in Missouri.","[{'name': 'subject', 'value': 'Aviation Accidents, Safety and Disasters', 'rank': 1, 'major': 'N'}, {'name': 'glocations', 'value': 'Philadelphia (Pa)', 'rank': 2, 'major': 'N'}, {'name': 'subject', 'value': 'AIRLINES AND AIRPLANES', 'rank': 3, 'major': 'N'}, {'name': 'subject', 'value': 'Shopping Centers and Malls', 'rank': 4, 'major': 'N'}, {'name': 'organizations', 'value': 'Federal Aviation Administration', 'rank': 5, 'major': 'N'}, {'name': 'subject', 'value': 'Deaths (Fatalities)', 'rank': 6, 'major': 'N'}, {'name': 'organizations', 'value': 'National Transportation Safety Board', 'rank': 7, 'major': 'N'}, {'name': 'glocations', 'value': 'Pennsylvania', 'rank': 8, 'major': 'N'}, {'name': 'glocations', 'value': 'Mexico', 'rank': 9, 'major': 'N'}, {'name': 'glocations', 'value': 'Tijuana (Mexico)', 'rank': 10, 'major': 'N'}]","A small medical plane carrying six people crashed near a shopping center in Northeast Philadelphia on Friday night, apparently leaving no survivors and sending a large fireball into the air that engulfed vehicles and homes in flames, the authorities said.",2025-02-01T00:35:55Z
2025-02-01 00:38:07+00:00,"{'main': 'Don’t Look Back', 'kicker': None, 'content_kicker': None, 'print_headline': '', 'name': None, 'seo': None, 'sub': None}",A political reckoning? Not at the Democratic National Committee.,"[{'name': 'subject', 'value': 'Politics and Government', 'rank': 1, 'major': 'N'}, {'name': 'subject', 'value': 'Elections', 'rank': 2, 'major': 'N'}, {'name': 'subject', 'value': 'Presidential Election of 2024', 'rank': 3, 'major': 'N'}, {'name': 'organizations', 'value': 'Democratic National Committee', 'rank': 4, 'major': 'N'}, {'name': 'organizations', 'value': 'Democratic Party', 'rank': 5, 'major': 'N'}, {'name': 'persons', 'value': 'Brazile, Donna', 'rank': 6, 'major': 'N'}, {'name': 'persons', 'value': 'Dean, Howard', 'rank': 7, 'major': 'N'}, {'name': 'persons', 'value': 'Martin, Ken (1973- )', 'rank': 8, 'major': 'N'}, {'name': 'persons', 'value': """"O'Malley, Martin J"""", 'rank': 9, 'major': 'N'}, {'name': 'persons', 'value': 'Perez, Thomas E', 'rank': 10, 'major': 'N'}, {'name': 'persons', 'value': 'Psaki, Jennifer R', 'rank': 11, 'major': 'N'}]",What is the opposite of an autopsy?,2025-02-01T00:38:07Z
2025-02-01 00:42:11+00:00,"{'main': 'How the D.C. Plane Crash Shattered Wichita’s Big Dreams of Skating and Flight', 'kicker': None, 'content_kicker': None, 'print_headline': '', 'name': None, 'seo': None, 'sub': None}","The city had tried for years to host the U.S. Figure Skating Championships, and to get a direct flight to the northeast.","[{'name': 'subject', 'value': 'AIRLINES AND AIRPLANES', 'rank': 1, 'major': 'N'}, {'name': 'subject', 'value': 'Figure Skating', 'rank': 2, 'major': 'N'}, {'name': 'subject', 'value': 'United States Figure Skating Championships', 'rank': 3, 'major': 'N'}, {'name': 'subject', 'value': 'Aviation Accidents, Safety and Disasters', 'rank': 4, 'major': 'N'}, {'name': 'organizations', 'value': 'United States Figure Skating Assn', 'rank': 5, 'major': 'N'}, {'name': 'glocations', 'value': 'Wichita (Kan)', 'rank': 6, 'major': 'N'}]","Wichita might be the country’s smallest big city. Or perhaps the country’s largest town. It is both big, with nearly 400,000 residents, and 550,000 in the larger metro area; and small, the type of place where you know your banker and bump into a friend while running errands.",2025-02-01T00:42:11Z
2025-02-01 01:05:28+00:00,"{'main': 'Trump Moves to Invalidate Recent Labor Agreements With Federal Workers', 'kicker': None, 'content_kicker': None, 'print_headline': '', 'name': None, 'seo': None, 'sub': None}","The order is aimed at “last-minute, lame-duck” agreements signed by the Biden administration, a White House memo says.","[{'name': 'subject', 'value': 'Presidential Power (US)', 'rank': 1, 'major': 'N'}, {'name': 'subject', 'value': 'Government Employees', 'rank': 2, 'major': 'N'}, {'name': 'subject', 'value': 'United States Politics and Government', 'rank': 3, 'major': 'N'}, {'name': 'subject', 'value': 'Labor and Jobs', 'rank': 4, 'major': 'N'}, {'name': 'subject', 'value': 'Collective Bargaining', 'rank': 5, 'major': 'N'}, {'name': 'subject', 'value': 'Organized Labor', 'rank': 6, 'major': 'N'}, {'name': 'persons', 'value': 'Trump, Donald J', 'rank': 7, 'major': 'N'}]","In the latest effort to put his stamp on the federal work force, President Trump on Friday issued a memorandum invalidating government labor contracts finalized in the last 30 days before a presidential inauguration.",2025-02-01T01:05:28Z
2025-02-01 01:21:28+00:00,"{'main': 'U.S. Military Planes Deliver Deportees to Honduras', 'kicker': None, 'content_kicker': None, 'print_headline': '', 'name': None, 'seo': None, 'sub': None}",President Xiomara Castro previously warned that she could oust the American military from Honduras if President Trump pursued aggressive deportations.,"[{'name': 'subject', 'value': 'Illegal Immigration', 'rank': 1, 'major': 'N'}, {'name': 'subject', 'value': 'Deportation', 'rank': 2, 'major': 'N'}, {'name': 'subject', 'value': 'United States Defense and Military Forces', 'rank': 3, 'major': 'N'}, {'name': 'subject', 'value': 'United States International Relations', 'rank': 4, 'major': 'N'}, {'name': 'subject', 'value': 'United States Politics and Government', 'rank': 5, 'major': 'N'}, {'name': 'organizations', 'value': 'Customs and Border Protection (US)', 'rank': 6, 'major': 'N'}, {'name': 'organizations', 'value': 'Defense Department', 'rank': 7, 'major': 'N'}, {'name': 'organizations', 'value': 'United States Air Force', 'rank': 8, 'major': 'N'}, {'name': 'persons', 'value': 'Castro, Xiomara', 'rank': 9, 'major': 'N'}, {'name': 'persons', 'value': 'Petro, Gustavo', 'rank': 10, 'major': 'N'}, {'name': 'persons', 'value': 'Trump, Donald J', 'rank': 11, 'major': 'N'}]","Honduras received deportees on U.S. military flights on Friday, part of President Trump’s push to show that his administration is cracking down on migration at the southern border.",2025-02-01T01:21:28Z
2025-02-01 01:36:28+00:00,"{'main': 'More Than a Dozen Prosecutors at Washington U.S. Attorney’s Office Are Dismissed', 'kicker': None, 'content_kicker': None, 'print_headline': '', 'name': None, 'seo': None, 'sub': None}",Those informed of their dismissals had been hired to investigate the Jan. 6 riot as the office struggled to manage what became the largest prosecution in the department’s history.,"[{'name': 'subject', 'value': 'United States Politics and Government', 'rank': 1, 'major': 'N'}, {'name': 'subject', 'value': 'Federal Criminal Case Against Trump (Documents Case)', 'rank': 2, 'major': 'N'}, {'name': 'subject', 'value': 'Storming of the US Capitol (Jan, 2021)', 'rank': 3, 'major': 'N'}, {'name': 'subject', 'value': 'United States Attorneys', 'rank': 4, 'major': 'N'}, {'name': 'organizations', 'value': 'Justice Department', 'rank': 5, 'major': 'N'}, {'name': 'persons', 'value': 'Trump, Donald J', 'rank': 6, 'major': 'N'}, {'name': 'persons', 'value': 'Bove, Emil', 'rank': 7, 'major': 'N'}]","The Justice Department’s campaign of retribution against officials who investigated President Trump and his supporters accelerated late Friday with the firing of more than a dozen federal prosecutors at the U.S. attorney’s office in Washington, according to a department memo.",2025-02-01T01:36:28Z
2025-02-01 01:59:58+00:00,"{'main': 'Disabled Workers Express Fear and Dismay After Trump’s Claims About the F.A.A.', 'kicker': None, 'content_kicker': None, 'print_headline': '', 'name': None, 'seo': None, 'sub': None}",Critics said the president’s remarks after the crash caused damage to an already underrepresented segment of the work force.,[],"Miles O’Brien lost his left arm in 2014, losing with it his private pilot’s license. A journalist by trade, he had been flying for nearly thirty years, and it had become his personal passion.",2025-02-01T01:59:58Z
2025-02-01 02:11:32+00:00,"{'main': 'Boy, 8, Is Fatally Shot in Newark, Officials Say', 'kicker': None, 'content_kicker': None, 'print_headline': '', 'name': None, 'seo': None, 'sub': None}","A man wounded by gunfire was found several blocks from where the child was killed around the same time, but officials declined to say whether the shootings were related.","[{'name': 'subject', 'value': 'Murders, Attempted Murders and Homicides', 'rank': 1, 'major': 'N'}, {'name': 'organizations', 'value': 'Police Department (Newark, NJ)', 'rank': 2, 'major': 'N'}, {'name': 'glocations', 'value': 'Newark (NJ)', 'rank': 3, 'major': 'N'}]","An 8-year-old boy was fatally shot Friday evening in Newark about three blocks from where a 36-year-old man who had been wounded by gunfire was found, the authorities said.",2025-02-01T02:11:32Z
2025-02-01 02:11:46+00:00,"{'main': 'Venezuela Frees 6 Americans After Visit by Trump Envoy', 'kicker': None, 'content_kicker': None, 'print_headline': '', 'name': None, 'seo': None, 'sub': None}","Richard Grenell, the envoy for special missions, said he was flying home with the detainees after he met with President Nicolás Maduro.","[{'name': 'subject', 'value': 'International Relations', 'rank': 1, 'major': 'N'}, {'name': 'subject', 'value': 'United States International Relations', 'rank': 2, 'major': 'N'}, {'name': 'subject', 'value': 'United States Politics and Government', 'rank': 3, 'major': 'N'}, {'name': 'subject', 'value': 'Political Prisoners', 'rank': 4, 'major': 'N'}, {'name': 'persons', 'value': 'Grenell, Richard', 'rank': 5, 'major': 'N'}, {'name': 'persons', 'value': 'Maduro, Nicolas', 'rank': 6, 'major': 'N'}, {'name': 'persons', 'value': 'Trump, Donald J', 'rank': 7, 'major': 'N'}, {'name': 'glocations', 'value': 'Venezuela', 'rank': 8, 'major': 'N'}]","Richard Grenell, President Trump’s envoy for special missions, said on social media that he was flying home from Venezuela with six American detainees on Friday, after meeting with the country’s president.",2025-02-01T02:11:46Z
2025-02-01 03:00:06+00:00,"{'main': 'Pseudoscientific Bodily Emanations', 'kicker': 'Wordplay, The CROSSWORD COLUMN', 'content_kicker': None, 'print_headline': '', 'name': None, 'seo': None, 'sub': None}",Kate Chin Park and Rafael Musa’s puzzle rewards an eye for detail.,"[{'name': 'subject', 'value': 'Crossword Puzzles', 'rank': 1, 'major': 'N'}, {'name': 'persons', 'value': 'Truth, Sojourner', 'rank': 2, 'major': 'N'}]","SATURDAY PUZZLE — This grid is an appealing collaboration between a relative newbie, Kate Chin Park, and Rafael Musa, a veteran who has teamed up with many other constructors. There’s a bite to it, mainly from its literary and historical trivia, but the crosses are pretty generous — every time I thought I was stuck in a row, I kept up my momentum by coming up with some letters from Down columns, which were slightly less thorny.",2025-02-01T03:00:06Z
2025-02-01 04:40:04+00:00,"{'main': 'Trump Officials Release Water in California That Experts Say Will Serve Little Use', 'kicker': None, 'content_kicker': None, 'print_headline': '', 'name': None, 'seo': None, 'sub': None}","Local officials and experts said the water the U.S. Army Corps of Engineers began sending downstream on Friday could have been helpful to farmers later this year. President Trump, in an apparent reference to the move, called it a “victory.”","[{'name': 'glocations', 'value': 'California', 'rank': 1, 'major': 'N'}, {'name': 'glocations', 'value': 'Central Valley (Calif)', 'rank': 2, 'major': 'N'}, {'name': 'subject', 'value': 'Water', 'rank': 3, 'major': 'N'}, {'name': 'subject', 'value': 'Federal-State Relations (US)', 'rank': 4, 'major': 'N'}, {'name': 'subject', 'value': 'Southern California Wildfires (Jan 2025)', 'rank': 5, 'major': 'N'}, {'name': 'subject', 'value': 'Levees and Dams', 'rank': 6, 'major': 'N'}, {'name': 'subject', 'value': 'Executive Orders and Memorandums', 'rank': 7, 'major': 'N'}, {'name': 'persons', 'value': 'Trump, Donald J', 'rank': 8, 'major': 'N'}, {'name': 'organizations', 'value': 'Army Corps of Engineers', 'rank': 9, 'major': 'N'}]",Trump administration officials began releasing significant amounts of water from two dams in California’s Central Valley on Friday in a move that seemed intended to make a political point as President Trump continued to falsely blame the Los Angeles wildfires on water policies in the Democratic-run state.,2025-02-01T04:40:04Z
2025-02-01 04:55:00+00:00,"{'main': 'Quote of the Day: A Farm’s Offer — 40,000 Pounds of Free Salmon', 'kicker': None, 'content_kicker': None, 'print_headline': 'Quote of the Day', 'name': None, 'seo': None, 'sub': None}","Quotation of the Day for Saturday, February 1, 2025.",[],"“The fish, they often don’t want to be caught.”",2025-02-01T04:55:00Z
2025-02-01 05:00:00+00:00,"{'main': 'Why Is Violence Flaring Up in Mineral-Rich Congo?', 'kicker': None, 'content_kicker': None, 'print_headline': '', 'name': None, 'seo': None, 'sub': None}","Rebels backed by Rwanda are seizing huge tracts of the Democratic Republic of Congo. The rebels, known as M23, say they are protecting ethnic Tutsis, the minority group massacred in a 1994 genocide. But experts say the real reason is Congo’s rare minerals, which power our phones and devices. Ruth Maclean, New York Times West Africa bureau chief, explains how the rebels and their patrons in Rwanda are profiting from the conflict.","[{'name': 'subject', 'value': 'War Crimes, Genocide and Crimes Against Humanity', 'rank': 1, 'major': 'N'}, {'name': 'subject', 'value': 'Minorities', 'rank': 2, 'major': 'N'}, {'name': 'organizations', 'value': 'March 23 Movement', 'rank': 3, 'major': 'N'}, {'name': 'glocations', 'value': 'Congo, Democratic Republic of (Congo-Kinshasa)', 'rank': 4, 'major': 'N'}, {'name': 'glocations', 'value': 'AFRICA', 'rank': 5, 'major': 'N'}, {'name': 'glocations', 'value': 'Rwanda', 'rank': 6, 'major': 'N'}]","Rebels backed by Rwanda are seizing huge tracts of the Democratic Republic of Congo. The rebels, known as M23, say they are protecting ethnic Tutsis, the minority group massacred in a 1994 genocide. But experts say the real reason is Congo’s rare minerals, which power our phones and devices. Ruth Maclean, New York Times West Africa bureau chief, explains how the rebels and their patrons in Rwanda are profiting from the conflict.",2025-02-01T05:00:00Z
2025-02-01 05:01:05+00:00,"{'main': 'Want a Million Dollars? Get Busy Deciphering This Ancient Script.', 'kicker': None, 'content_kicker': None, 'print_headline': 'Want $1 Million? Decipher This Ancient Script.', 'name': None, 'seo': None, 'sub': None}",A prize offered by an Indian state leader is intended to shed light on a Bronze Age civilization — and settle a cultural battle.,"[{'name': 'subject', 'value': 'Hinduism', 'rank': 1, 'major': 'N'}, {'name': 'subject', 'value': 'Archaeology and Anthropology', 'rank': 2, 'major': 'N'}, {'name': 'subject', 'value': 'Language and Languages', 'rank': 3, 'major': 'N'}, {'name': 'glocations', 'value': 'India', 'rank': 4, 'major': 'N'}]",It is a riddle that has confounded scholars for over a century. And now it carries a handsome cash prize: $1 million for anyone who can decipher the script of the ancient Indus Valley civilization.,2025-02-01T05:01:05Z
2025-02-01 05:01:14+00:00,"{'main': 'Moo Deng, the Toddler Hippopotamus, Is Still a Star', 'kicker': 'Thailand Dispatch', 'content_kicker': None, 'print_headline': 'Forget Pokémon, Here’s the New Big Small Thing', 'name': None, 'seo': None, 'sub': None}","The pygmy hippopotamus, now 6 months old, is Thailand’s biggest celebrity, and the crowds keep flocking. What explains her charm?","[{'name': 'glocations', 'value': 'Thailand', 'rank': 1, 'major': 'N'}, {'name': 'subject', 'value': 'Hippopotamuses', 'rank': 2, 'major': 'N'}, {'name': 'subject', 'value': 'Zoos', 'rank': 3, 'major': 'N'}, {'name': 'subject', 'value': 'Endangered and Extinct Species', 'rank': 4, 'major': 'N'}, {'name': 'organizations', 'value': 'Khao Kheow Open Zoo', 'rank': 5, 'major': 'N'}]",Moo Deng doesn’t bounce like she did a couple months ago.,2025-02-01T05:01:14Z
2025-02-01 06:06:04+00:00,"{'main': 'Criss-Crossing Routes in D.C. Airspace Leave Little Room for Error', 'kicker': None, 'content_kicker': None, 'print_headline': '', 'name': None, 'seo': None, 'sub': None}",Planes assigned to land at Reagan’s Runway 33 must fly just above a route that is busy with helicopters.,"[{'name': 'subject', 'value': 'American Airlines Flight 5342', 'rank': 1, 'major': 'N'}, {'name': 'subject', 'value': 'Airports', 'rank': 2, 'major': 'N'}, {'name': 'organizations', 'value': 'Federal Aviation Administration', 'rank': 3, 'major': 'N'}]",Planes assigned to land at Reagan’s Runway 33 must fly just above a route that is busy with helicopters.,2025-02-01T06:06:04Z
2025-02-01 06:09:51+00:00,"{'main': 'The Los Angeles Wildfires Are Fully Contained', 'kicker': None, 'content_kicker': None, 'print_headline': '', 'name': None, 'seo': None, 'sub': None}","The Palisades and Eaton fires, two of the deadliest and most destructive wildfires in California history, reached 100 percent containment more than three weeks after they began.","[{'name': 'subject', 'value': 'Southern California Wildfires (Jan 2025)', 'rank': 1, 'major': 'N'}, {'name': 'glocations', 'value': 'Altadena (Calif)', 'rank': 2, 'major': 'N'}, {'name': 'glocations', 'value': 'Pacific Palisades (Calif)', 'rank': 3, 'major': 'N'}, {'name': 'subject', 'value': 'Deaths (Fatalities)', 'rank': 4, 'major': 'N'}]","More than three weeks after the devastating Eaton and Palisades fires broke out in Southern California, state officials on Friday evening said that firefighters had fully contained both fires, meaning that the perimeters of the fires were completely under control.",2025-02-01T06:09:51Z
2025-02-01 08:00:04+00:00,"{'main': 'Spelling Bee Forum', 'kicker': None, 'content_kicker': None, 'print_headline': '', 'name': None, 'seo': None, 'sub': None}",Feeling stuck on today’s puzzle? We can help.,"[{'name': 'creative_works', 'value': 'Spelling Bee (Game)', 'rank': 1, 'major': 'N'}]","Hi, busy bees! Welcome to today’s Spelling Bee forum. Enter the comments section to see hints, conversation, helpful tips and creative content from other solvers.",2025-02-01T08:00:04Z
